{
  "commandType": "CreateObject",
  "workspaceId": "11111111-1111-4111-8111-111111111111",
  "correlationId": "22222222-2222-4222-8222-222222222222",
  "idempotencyKey": "create-object-1",
  "payload": {
    "objectTypeId": "33333333-3333-4333-8333-333333333333",
    "fields": { "name": "demo" },
    "source": { "type": "manual" }
  }
}
