{
  "commandType": "ConfirmAIChangeSet",
  "workspaceId": "11111111-1111-4111-8111-111111111111",
  "correlationId": "22222222-2222-4222-8222-222222222222",
  "idempotencyKey": "ai-confirm-33333333-3333-4333-8333-333333333333",
  "payload": {
    "changeSetId": "33333333-3333-4333-8333-333333333333",
    "decision": "confirm",
    "acceptedItems": ["item-1"],
    "rejectedItems": []
  }
}
