{
  "commandType": "ChangeState",
  "workspaceId": "11111111-1111-4111-8111-111111111111",
  "correlationId": "22222222-2222-4222-8222-222222222222",
  "idempotencyKey": "change-state-1",
  "payload": {
    "targetType": "object",
    "targetId": "33333333-3333-4333-8333-333333333333",
    "fromState": "DRAFT",
    "toState": "PENDING_CONFIRM",
    "reason": "submit",
    "expectedVersion": 1
  }
}
