{
  "commandType": "CreateRelation",
  "workspaceId": "11111111-1111-4111-8111-111111111111",
  "correlationId": "22222222-2222-4222-8222-222222222222",
  "idempotencyKey": "create-relation-1",
  "payload": {
    "relationTypeId": "33333333-3333-4333-8333-333333333333",
    "sourceId": "44444444-4444-4444-8444-444444444444",
    "targetId": "55555555-5555-4555-8555-555555555555",
    "source": { "type": "manual" }
  }
}
